num,title,image,label
3933,粤持续降雨 中北部市县土壤水分趋近饱和或超饱和,images/real_news_image/15977.jpg,0
3934,茶博会涌现“新茶事”  年轻消费群体崛起,images/real_news_image/13521.jpg,0
3935,贵州安顺普定老农贸市场执法人员打人,images/fake_news_image/3127.jpg,1
3936,上海奉贤第一例新冠确诊病例治愈后复阳,images/fake_news_image/6685.jpg,1
3937,复旦大学亮灯支持乌克兰,images/fake_news_image/5535.jpg,1
3938,俄罗斯留学生成新“广府人”：喜爱“猪脚姜”  分享汉语学习“秘籍”,images/real_news_image/6839.jpg,0
3939,纽约新市长上任高唱中国国歌,images/fake_news_image/5631.jpg,1
3940,白杨市：中国最年轻城市的诞生,images/real_news_image/5801.jpg,0
3941,端午假期将至 两小时高铁圈内短途游成热门,images/real_news_image/13599.jpg,0
3942,网络安全审查办公室对美光公司在华销售产品启动网络安全审查,images/real_news_image/6486.jpg,0
3943,个人破产将试行，欠债可以不还了,images/fake_news_image/6958.jpg,1
3944,花菇中的多糖能增强人体免疫力，对抗新型冠状病毒,images/fake_news_image/8586.jpg,1
3945,夏日戴太阳镜可能反而伤眼,images/fake_news_image/3485.jpg,1
3946,国考补录5月8日起报名 计划招录3911人,images/real_news_image/15072.jpg,0
3947,生态环境部：“锰三角”污染治理取得阶段性成效,images/real_news_image/15845.jpg,0
3948,中国成品油价迎年内最大跌幅 部分地区柴油将重返“6元时代”,images/real_news_image/2806.jpg,0
3949,近期有强台风生成，并将登陆华南地区,images/fake_news_image/6634.jpg,1
3950,银离子抗菌液能杀灭新冠病毒,images/fake_news_image/10080.jpg,1
3951,国台办：解决台湾问题是两岸中国人自己的事 不容外人置喙,images/real_news_image/9152.jpg,0
3952,大陆因素阻碍BNT辉瑞疫苗售台,images/fake_news_image/9651.jpg,1
3953,中新真探：“每天只需睡2小时”说法不靠谱,images/real_news_image/15287.jpg,0
3954,为保持社交间距 日本东京酒店打造用餐“防护罩”,images/real_news_image/10642.jpg,0
3955,西班牙拉帕尔马岛火山持续喷发 吸引民众围观,images/real_news_image/3196.jpg,0
3956,不要穿毛衣或带毛领、绒线的衣服外套，容易吸附病毒,images/fake_news_image/6856.jpg,1
3957,雾化不是滥用抗生素，家长无需过分担心          ,images/fake_news_image/4533.jpg,1
3958,演员李立群在封控期间只能喝自来水、啃窝窝头,images/fake_news_image/8052.jpg,1
3959,富士康恢复生产计划被政府叫停,images/fake_news_image/6793.jpg,1
3960,（聚焦中国高质量发展）走进爱达·魔都号：中国的海上新名片,images/real_news_image/13418.jpg,0
3961,美国纽约殡葬公司员工累倒午睡，被同事误当尸体火化,images/fake_news_image/8280.jpg,1
3962,2016年9月10日起，持教师资格证可免费游全国景区,images/fake_news_image/6559.jpg,1
3963,内地赴港“个人游”城市再扩容 李家超：有力提振旅游等行业,images/real_news_image/14759.jpg,0
3964,化疗会导致癌细胞扩散,images/fake_news_image/5170.jpg,1
3965,琉球群岛发生5.9级地震 震源深度10千米,images/real_news_image/2951.jpg,0
3966,6月中国大宗商品价格指数为116.8点 总体保持扩张,images/real_news_image/10405.jpg,0
3967,全国养老服务监管工作会议召开,images/real_news_image/9851.jpg,0
3968,网传视频拍到北京一高楼失火,images/fake_news_image/3471.jpg,1
3969,赴韩签证全面开放 护照可任意办理,images/fake_news_image/9621.jpg,1
3970,国家统计局：4月份规模以上工业原煤、原油、天然气、电力生产总体平稳,images/real_news_image/14261.jpg,0
3971,河北“长城楼长”张鹤珊：长城是我生命的一部分,images/real_news_image/3262.jpg,0
3972,人民日报仲音：重大决定性胜利，人类文明史上的奇迹,images/real_news_image/5017.jpg,0
3973,韩国计划将汉字申遗被联合国警告,images/fake_news_image/5556.jpg,1
3974,特朗普赢了三分之二大选舞弊的官司,images/fake_news_image/5816.jpg,1
3975,柑橘打甜蜜素！很多水果都打！农民的话你还真敢信啊,images/fake_news_image/4611.jpg,1
3976,菠萝与可乐混合的菠萝汁不能喝          ,images/fake_news_image/4065.jpg,1
3977,【青听·两岸】台青在大陆创业：像鱼缸里的鱼回到了大海,images/real_news_image/5524.jpg,0
3978,晚上吃姜可能影响睡眠 但吃姜不等于吃砒霜          ,images/fake_news_image/4788.jpg,1
3979,（身边的变化）中国医保如何惠民生？,images/real_news_image/9906.jpg,0
3980,女子违规携带宠物蜜袋鼯登机致航班延误 已被行拘,images/real_news_image/12245.jpg,0
3981,马云做岳父，转发信息得“300话费”,images/fake_news_image/3438.jpg,1
3982,磁暴很容易造成卫星大量故障,images/fake_news_image/3901.jpg,1
3983,突发！美国得州商业区枪击案已致9死7伤,images/real_news_image/5913.jpg,0
3984,农业农村部：今年夏粮产量达到2995.6亿斤 再创历史新高,images/real_news_image/9149.jpg,0
3985,"阿布扎比遭遇火箭袭击,胡塞武装对此负责",images/fake_news_image/6305.jpg,1
3986,今晚不要开窗户，广州半夜将大面积全面消杀,images/fake_news_image/8069.jpg,1
3987,文旅局长从幕后“卷”到了台前 出游数据狂飙,images/real_news_image/3840.jpg,0
3988,暴雨红色预警连续发布 专家：降水致灾可能性较大,images/real_news_image/11168.jpg,0
3989,他宣布参加2024年美国总统选举，竞选原因是……,images/real_news_image/6179.jpg,0
3990,陆家嘴惊现“空中飞人天雷渡劫”,images/fake_news_image/3110.jpg,1
3991,游客探秘越南最大天然洞穴 置身其中仿佛“地心历险”,images/real_news_image/13803.jpg,0
3992,中俄两大界江进入35天禁渔期 渔船网具全上岸,images/real_news_image/12258.jpg,0
3993,国际识局：莫迪在莫斯科“拥抱普京”，美国及其盟国“大为恼火”,images/real_news_image/10085.jpg,0
3994,感染过新冠的人都要去拍肺部CT,images/fake_news_image/7945.jpg,1
3995,少先队队旗国家标准将于6月1日实施,images/real_news_image/13089.jpg,0
3996,俄罗斯圣彼得堡市一军校发生爆炸致7人受伤,images/real_news_image/14178.jpg,0
3997,2023年国家医保目录调整征求意见：6月底前获批药物均可参与，谈判最早9月,images/real_news_image/4946.jpg,0
3998,美媒：拜登新冠检测结果转阴,images/real_news_image/9188.jpg,0
3999,美国佐治亚州发生枪击事件 致11人受伤,images/real_news_image/14047.jpg,0
4000,大四女生宿舍内身亡 杀室友抛尸,images/fake_news_image/7746.jpg,1
4001,俄军在乌克兰使用亚核武级别的“空气炸弹”,images/fake_news_image/6276.jpg,1
4002,中国和巴基斯坦“密谋阿富汗领土”,images/fake_news_image/6136.jpg,1
4003,张文宏谈新建“临床病原微生物网络实验室”：早预检早预警,images/real_news_image/4984.jpg,0
4004,成都百寿路出现猴痘病例并隔离,images/fake_news_image/9218.jpg,1
4005,2023年“五一”假期全国民航、铁路、票房数据来了,images/real_news_image/3168.jpg,0
4006,今日广西海南岛等地雨势较强 南海热带扰动将加强为热带低压,images/real_news_image/13160.jpg,0
4007,“开往春天的列车”穿越长城脚下烂漫花海,images/real_news_image/10521.jpg,0
4008,养老金没钱了，退休职工养老金不能按时足额发放,images/fake_news_image/10218.jpg,1
4009,意大利高温预警城市增至17个 最高温预计将达40℃,images/real_news_image/9492.jpg,0
4010,人这一辈子，一定要去一趟扬州！,images/real_news_image/11302.jpg,0
4011,甜蜜素可以增加水果的甜度,images/fake_news_image/4193.jpg,1
4012,金正恩指导超大型火箭炮部队进行核反击模拟演习,images/real_news_image/16324.jpg,0
4013,解放军主力装备“出镜记”,images/real_news_image/8386.jpg,0
4014,“桃子不能与西瓜一起吃”,images/fake_news_image/7219.jpg,1
4015,四川绵竹市发生3.0级地震 震源深度13千米,images/real_news_image/14459.jpg,0
4016,上海移动手机用户13日起未实名将被停机,images/fake_news_image/3460.jpg,1
4017,动动手指 就可以把梵高的作品挂在墙上啦,images/real_news_image/10301.jpg,0
4018,新漫评： 挥舞美元大棒 美国“霸权游戏”祸害世界,images/real_news_image/5701.jpg,0
4019,国台办回应捷克众议长近期窜台,images/real_news_image/4348.jpg,0
4020,美“第42条法案”失效后，美墨边境会完全开放,images/fake_news_image/5991.jpg,1
4021,爱心筹款因转发次数不够无法到账,images/fake_news_image/2765.jpg,1
4022,贪官“三步腐”轨迹：攀附上位、拉帮结派、腐化堕落,images/real_news_image/2778.jpg,0
4023,中国和新西兰举行第12次两军战略对话,images/real_news_image/7059.jpg,0
4024,走进安徽黟县宏村 感受“中国画里乡村”魅力,images/real_news_image/14589.jpg,0
4025,当缤纷地球遇见绝美中国色,images/real_news_image/3686.jpg,0
4026,12名中国维和警察将赴南苏丹执行维和任务,images/real_news_image/14009.jpg,0
4027,人这一辈子，一定要去一趟霍尔果斯！,images/real_news_image/4457.jpg,0
4028,国民警卫队士兵背对拜登表达不满,images/fake_news_image/5839.jpg,1
4029,广东普宁一快递点发生刑事案件致1死1伤 嫌疑人被刑拘,images/real_news_image/8838.jpg,0
4030,局部腐烂的苹果会致癌,images/fake_news_image/2913.jpg,1
4031,以岭药业发布第三季度报告,images/real_news_image/4897.jpg,0
4032,哈马斯领导人在伊朗遇袭 美国白宫和以色列发声,images/real_news_image/8506.jpg,0
4033,央行将80天内落地数字货币,images/fake_news_image/6944.jpg,1
4034,四部门：做好金融支持大规模设备更新和消费品以旧换新工作,images/real_news_image/15846.jpg,0
4035,俄媒称乌军对新卡霍夫卡进行大规模打击 乌方尚未回应,images/real_news_image/3764.jpg,0
4036,假日里的“唐潮”：“Z世代”汉服妆造师点染长安之韵,images/real_news_image/15216.jpg,0
4037,突发！超10架无人机试图袭击克里米亚,images/real_news_image/3101.jpg,0
4038,“俄罗斯空袭卢甘斯克发电厂”引起爆炸,images/fake_news_image/6295.jpg,1
4039,朝鲜谴责北约《华盛顿峰会宣言》,images/real_news_image/9876.jpg,0
4040,特朗普又出新招，成立国家审查中心,images/fake_news_image/5925.jpg,1
4041,跨国企业为何持续“加仓”中国市场？,images/real_news_image/6314.jpg,0
4042,石家庄“异地不返乡过年能领政府补贴”,images/fake_news_image/9737.jpg,1
4043,韩国抗议日本《外交蓝皮书》对独岛主权主张,images/real_news_image/3981.jpg,0
4044,多国央行“购金热”延续说明什么,images/real_news_image/14061.jpg,0
4045,或于下周被“逮捕”？特朗普呼吁支持者抗议,images/real_news_image/4669.jpg,0
4046,新漫评：冲闯黄岩岛？小心变“炮灰”,images/real_news_image/13540.jpg,0
4047,今年个税汇算首月专项附加扣除减税达1500多亿元,images/real_news_image/6423.jpg,0
4048,以色列普京酒吧改名泽连斯基?,images/fake_news_image/5492.jpg,1
4049,重庆现震撼云瀑奇观,images/real_news_image/14992.jpg,0
4050,王广发委员：建立一套国家级封闭公共空间空气生物安全监控机制,images/real_news_image/5000.jpg,0
4051,自媒体博主被「氛围灯」照到差点失明,images/fake_news_image/3886.jpg,1
4052,内蒙古包头刑事案件嫌疑人落网 此前警方悬赏5万通缉,images/real_news_image/14499.jpg,0
4053,中国房地产“白名单”项目获批融资近1.4万亿元,images/real_news_image/7124.jpg,0
4054,一周年迎来新成员 东航第6架C919飞抵上海虹桥机场正式入列,images/real_news_image/13294.jpg,0
4055,与王思聪家族有合作的匹兹堡大学医学中心参与研制了辉瑞“神药”,images/fake_news_image/5439.jpg,1
4056,东京奥运村和吉祥物合影要收钱,images/fake_news_image/5683.jpg,1
4057,社会面核酸检测量呈断崖式下降：多地取消免费核酸采样点,images/real_news_image/5187.jpg,0
4058,“全职儿女”不是啃老，别对自由择业有偏见,images/real_news_image/3608.jpg,0
4059,粉黛乱子草“浪漫”绽放 邂逅这片“粉雾海”,images/real_news_image/9330.jpg,0
4060,7月25日24时起，国内汽、柴油价格每吨分别降低145元、140元,images/real_news_image/8955.jpg,0
4061,布林肯与拉夫罗夫罕见通话，讨论了这件事,images/real_news_image/4222.jpg,0
4062,"校车坠河,十几名学生溺亡",images/fake_news_image/3116.jpg,1
4063,铭记！多地举行“九一八”事变爆发90周年纪念仪式,images/real_news_image/11616.jpg,0
4064,意大利新冠疫情严重，军方动用坦克封城,images/fake_news_image/6717.jpg,1
4065,工信部组织开展2024年老年用品产品推广目录申报工作,images/real_news_image/13293.jpg,0
4066,河北省人大常委会原副主任王雪峰一审被控受贿逾8000万元,images/real_news_image/12988.jpg,0
4067,泪目！这是李白牺牲前发出的最后一封绝密电报……,images/fake_news_image/8728.jpg,1
4068,"是真的,饭后百步走，活到九十九",images/fake_news_image/4576.jpg,1
4069,暑期催热“萌经济” 南宁年轻人热衷“复古店铺”,images/real_news_image/9458.jpg,0
4070,多位医药系统官员落马！10省份紧急大检查,images/real_news_image/15612.jpg,0
4071,江旻憓AB面：坚强的击剑冠军 感性的“不完美”女孩,images/real_news_image/7624.jpg,0
4072,两部门发布6月份全国自然灾害风险形势,images/real_news_image/12632.jpg,0
4073,6月中国快递发展指数同比提升18.4%,images/real_news_image/9937.jpg,0
4074,前“东家”提供背调信息侵犯劳动者个人信息权吗？,images/real_news_image/7994.jpg,0
4075,4.88万亿元！上半年我国食材消费规模同比增长7.86%,images/real_news_image/7089.jpg,0
4076,MINI中国道歉！Luneurs称未参与上海车展现场运营,images/real_news_image/6198.jpg,0
4077,去耕作、去流汗、去收获 这些年轻人为何在城里种地上瘾,images/real_news_image/8609.jpg,0
4078,南部战区位南海黄岩岛附近海空域组织联合战巡,images/real_news_image/8047.jpg,0
4079,因为特殊法律，纽约人在亚裔遇袭时见死不救,images/fake_news_image/5778.jpg,1
4080,（财经天下）报告：东南亚成为亚太跨境房产投资新兴目的地,images/real_news_image/11687.jpg,0
4081,3月LPR报价出炉：1年期3.65% 5年期以上4.3%,images/real_news_image/6691.jpg,0
4082,给工资取个生活费等“别名”，就能逃避劳动关系了吗？,images/real_news_image/10518.jpg,0
4083,苏轼主题文物展在海口向公众开放 “宋四家”真迹首次故宫外共同展出,images/real_news_image/6947.jpg,0
4084,山西左权太行山脉现日出云海景观,images/real_news_image/8395.jpg,0
4085,俄乌局势进展：扎波罗热核电站所在城市疏散居民 俄媒称乌军空袭克里米亚,images/real_news_image/5905.jpg,0
4086,学校体育场馆向社会免费开放,images/fake_news_image/9654.jpg,1
4087,今年前7月中国太阳能发电装机容量同比增近50%,images/real_news_image/6968.jpg,0
4088,武汉：黄鹤楼上景依旧 生活气息渐恢复,images/real_news_image/16284.jpg,0
4089,IMF预计2023年全球经济增长2.8% 中国经济增长5.2%,images/real_news_image/3980.jpg,0
4090,游戏带火取景地 山西“悬塑绝唱”小西天景区客流翻倍,images/real_news_image/7024.jpg,0
4091,周鸿祎离婚被分走90亿元 5年前往事浮出水面,images/real_news_image/4163.jpg,0
4092,连吃7天柚子后“肌肉溶解”，都是柚子惹的祸,images/fake_news_image/10032.jpg,1
4093,！长沙第一高楼九龙仓起火了,images/fake_news_image/7619.jpg,1
4094,银耳能美容吃酱油会变黑,images/fake_news_image/7566.jpg,1
4095,泰国幼儿园枪击事件已致38人死亡 枪手开枪自杀,images/real_news_image/9368.jpg,0
4096,上海三个地区调为低风险地区,images/real_news_image/11095.jpg,0
4097,评《我的阿勒泰》：乐见有创造力的文学“魔改”,images/real_news_image/14493.jpg,0
4098,新能源车险保费大增背后：赔付率超油车，行业如何提升利润？,images/real_news_image/4103.jpg,0
4099,国足今迎世预赛生死战 客战韩国队但求不留遗憾,images/real_news_image/12283.jpg,0
4100,相较于其他新能源汽车 氢能源车有哪些独特优势？,images/real_news_image/3306.jpg,0
4101,"网传快递春节期间不揽收,长假买买买得“剁手”",images/fake_news_image/3397.jpg,1
4102,东契奇末节被罚出场，凯尔特人再胜独行侠,images/real_news_image/12058.jpg,0
4103,国防部回应美方威胁恫吓：从来不吃这一套,images/real_news_image/10999.jpg,0
4104,台风“珊珊”将趋向日本以南洋面 未来对我国海域无影响,images/real_news_image/7006.jpg,0
4105,四川稻城森林火灾：地空协同全力扑打雷击森林火灾,images/real_news_image/3652.jpg,0
4106,中国华融国际控股有限公司原总经理白天辉受贿案一审宣判,images/real_news_image/13266.jpg,0
4107,取样返回后中国如何探测火星？专家：建设火星科研站,images/real_news_image/3533.jpg,0
4108,全球创业者峰会获奖者：感受到被政府和行业资本关注,images/real_news_image/6746.jpg,0
4109,奥巴马“政治导师”领导恐怖组织轰炸公共建筑,images/fake_news_image/6340.jpg,1
4110,丹麦菲英岛晨雾弥漫 如遗世秘境,images/real_news_image/14794.jpg,0
4111,浙江缙云南顿菜场有冷冻食品检出新冠病毒阳性,images/fake_news_image/9816.jpg,1
4112,格陵兰岛冰山漂过 夕阳映照冰雪美如画,images/real_news_image/3444.jpg,0
4113,交通运输部：8月19日-8月25日全国货运物流有序运行,images/real_news_image/6781.jpg,0
4114,中国的世界自然遗产 你知道几个？,images/real_news_image/12409.jpg,0
4115,十一期间武汉硚口区有一千多人去过青岛,images/fake_news_image/8230.jpg,1
4116,专家：未来两三个月，此前没有“阳过”的人感染新冠风险依然较高,images/real_news_image/4958.jpg,0
4117,国际粮价暴涨，会影响中国人的“饭碗”,images/fake_news_image/9511.jpg,1
4118,看了这篇文章，再也不用担心胆固醇了          ,images/fake_news_image/5134.jpg,1
4119,电商平台新趋势：618用上AI,images/real_news_image/11611.jpg,0
4120,漫话节气丨芒种：一壶青梅酒 四野皆插秧,images/real_news_image/5386.jpg,0
4121,"明查 | 英国发明“九宫格”红绿灯,因造成交通混乱被废除",images/fake_news_image/6114.jpg,1
4122,服用黑芝麻丸能够预防脱发,images/fake_news_image/9056.jpg,1
4123,门票何时开售？成都大运会最新进展来了,images/real_news_image/6221.jpg,0
4124,成都空气污染指数世界第三,images/fake_news_image/7698.jpg,1
4125,1至7月全国铁路完成固定资产投资4102亿元 同比增长10.5%,images/real_news_image/8044.jpg,0
4126,少数台湾所谓“名嘴”散布谣言抹黑大陆 国台办：将依法实施惩戒,images/real_news_image/14448.jpg,0
4127,只有服用头孢类药物时才需避免饮酒,images/fake_news_image/3767.jpg,1
4128,中新真探：乳腺增生是癌前病变吗？,images/real_news_image/13514.jpg,0
4129,无需出国就可获海外文凭,images/fake_news_image/9540.jpg,1
4130,淄博烧烤“问道”柳州螺蛳粉，中国网红城市探索“常红”之道,images/real_news_image/2720.jpg,0
4131,工信部：强化电动自行车用锂离子蓄电池安全要求,images/real_news_image/15182.jpg,0
4132,全国春季游泳锦标赛：覃海洋男子50米蛙泳超亚洲纪录,images/real_news_image/4466.jpg,0
4133,广西柳州螺蛳粉“官宣”英文名 保留“原汁原味”,images/real_news_image/14241.jpg,0
4134,大盘鸡能传播同性恋容易得,images/fake_news_image/7702.jpg,1
4135,应急管理部紧急跨省区调派排涝力量增援湖南平江,images/real_news_image/10589.jpg,0
4136,中国“起重机械之都”：出口订单迅增 销往全球逾百国,images/real_news_image/10183.jpg,0
4137,聚焦“两弹一星”相继突破 中国科技馆推出“无声的惊雷”展览,images/real_news_image/10876.jpg,0
4138,大连新冠疫情与北京新疆疫情有关联,images/fake_news_image/8243.jpg,1
4139,冬奥会期间将大面积关停企业,images/fake_news_image/9141.jpg,1
4140,宜昌一漂流景区发生溺亡事故,images/fake_news_image/6599.jpg,1
4141,建军90周年纪念币热卖,images/fake_news_image/7460.jpg,1
4142,“4G流量免费送”链接是病毒,images/fake_news_image/3394.jpg,1
4143,加湿器里加香薰精油、醋、板蓝根功效强大,images/fake_news_image/10102.jpg,1
4144,上海中心大厦漏水致天花板坍塌，公交像开船,images/fake_news_image/6644.jpg,1
4145,欧盟启动加沙地带医疗后送 首批16名儿童转至西班牙救治,images/real_news_image/9067.jpg,0
4146,英国首相苏纳克将牛肉从首相府菜单中删除,images/fake_news_image/6071.jpg,1
4147,鹤岗市第六届梨花节开幕 万株梨花盛放迎客,images/real_news_image/2808.jpg,0
4148,台媒：洪都拉斯对台下达“必须30天内撤馆”命令,images/real_news_image/4382.jpg,0
4149,1—4月社会消费品零售总额15.6万亿元 同比增长4.1%,images/real_news_image/13642.jpg,0
4150,“雪豹之都”呼之欲出 青海西宁打造城市IP冀“流量”变“留量”,images/real_news_image/10661.jpg,0
4151,北京警方：一乘客携带刀具上地铁且拒不配合安检被刑拘,images/real_news_image/11263.jpg,0
4152,平陆运河企石枢纽上闸首首块输水廊道封顶,images/real_news_image/9824.jpg,0
4153,美联储宣布加息25个基点 未来货币政策走向成焦点,images/real_news_image/5975.jpg,0
4154,西班牙一动物园成功孵化濒临灭绝的科莫多巨蜥,images/real_news_image/6537.jpg,0
4155,第六届西洽会开幕 共签约196个重大项目,images/real_news_image/13684.jpg,0
4156,普京访朝，俄朝领导人互赠哪些礼物？,images/real_news_image/11505.jpg,0
4157,年轻人兴起“饮茶热”：得闲饮茶 不得闲也饮茶,images/real_news_image/13576.jpg,0
4158,"交规升级,私家车上高速4小时不休息要被扣完12分",images/fake_news_image/2761.jpg,1
4159,太原现代高架桥下的古代石拱桥,images/real_news_image/14276.jpg,0
4160,天津大中小学、幼儿园开学时间3月17日前已确定,images/fake_news_image/8344.jpg,1
4161,大量外地人员翻越高速围栏抄小道从金山进上海,images/fake_news_image/6797.jpg,1
4162,国安部：海底光缆已成个别国家眼中窃取情报的工具,images/real_news_image/13609.jpg,0
4163,中新人物 | 郑佩佩：“侠女”的一生,images/real_news_image/9509.jpg,0
4164,乌克兰受伤儿童在哭泣,images/fake_news_image/5542.jpg,1
4165,兰花放卧室里真的会让人失眠,images/fake_news_image/5144.jpg,1
4166,河南某粮仓内食物千年不腐,images/fake_news_image/9588.jpg,1
4167,热销品类卖断货！这项2.5亿人参与的运动太火爆了,images/real_news_image/9788.jpg,0
4168,2024年全国特奥乒乓球、羽毛球比赛在陕举行,images/real_news_image/10972.jpg,0
4169,“Z世代”古籍修复师的青春选择：妙手修补历史“伤痕”,images/real_news_image/9620.jpg,0
4170,《南海仲裁案裁决再批驳》报告发布：中国政府不会承认仲裁庭作出的非法裁决,images/real_news_image/10052.jpg,0
4171,房地产经纪服务新规出台释放哪些信号？,images/real_news_image/2944.jpg,0
4172,水利部指导各地完成承担防洪任务的大中型水库库容曲线复核,images/real_news_image/7465.jpg,0
4173,中国翼装飞行穿越天门洞第一人张树鹏：我只是征服了自己,images/real_news_image/3273.jpg,0
4174,俄乌谈判正式开始 现场画面曝光,images/real_news_image/10637.jpg,0
4175,直击现场！东部战区持续位台岛周边演习最新照片发布,images/real_news_image/13569.jpg,0
4176,青海三江源：拍到猞猁猎食藏羚羊,images/real_news_image/5952.jpg,0
4177,历时163天，行程6万余海里 第三十九次南极科考亮点多,images/real_news_image/5536.jpg,0
4178,乌克兰购物中心遇袭前已关闭数月空无一人,images/fake_news_image/5372.jpg,1
4179,贵州华南江南有分散性强降雨 北方气温升高接受“烤验”,images/real_news_image/12501.jpg,0
4180,经合组织秘书长警告西方：与中国“脱钩”将使世界更贫穷｜世界观,images/real_news_image/3365.jpg,0
4181,最新研究：20-40岁人血压超过130/80mmHg心脑血管疾病就会翻倍          ,images/fake_news_image/4140.jpg,1
4182,女人坐月子不能刷牙，是真的,images/fake_news_image/4950.jpg,1
4183,中国科研团队发现两个稀有鱼类新物种 系中国特有鱼类,images/real_news_image/9846.jpg,0
4184,仰头、捏鼻、塞纸止鼻血对,images/fake_news_image/5263.jpg,1
4185,"吃一粒就可以瘦2到8斤,真的有如此神奇的减肥药",images/fake_news_image/5065.jpg,1
4186,反中乱港组织香港公民党宣布解散,images/real_news_image/5552.jpg,0
4187,早烧不出门，晚烧行千里： ,images/fake_news_image/4874.jpg,1
4188,U19男足四国赛：中国队2：0击败韩国夺冠,images/real_news_image/12296.jpg,0
4189,转需提醒！当前疫情6大热点问答,images/real_news_image/5697.jpg,0
4190,2月4日成都市民可在天府市民云APP预约领取口罩,images/fake_news_image/8551.jpg,1
4191,德国三天内驱逐乌克兰驻德大使,images/fake_news_image/6224.jpg,1
4192,洪秀柱：两岸要谋求未来统一,images/real_news_image/3825.jpg,0
4193,日本严惩人贩子最低10年起判,images/fake_news_image/5600.jpg,1
