num,title,image,label
7843,“China Travel”成热搜 中方欢迎各国朋友来趟“说走就走”的中国行,images/real_news_image/10164.jpg,0
7844,浙江一游客排队区晕厥死亡,images/fake_news_image/7622.jpg,1
7845,五台山尼姑结婚，尼友前来祝福,images/fake_news_image/3338.jpg,1
7846,春至花约 | 与抗疫医护共赏武大“樱”姿,images/real_news_image/4675.jpg,0
7847,捏住老虎的后颈，它会像猫一样变乖,images/fake_news_image/3864.jpg,1
7848,樊振东：赢下比赛，也找回自己,images/real_news_image/12780.jpg,0
7849,伟鸿食品进口牛肉检测呈阳性,images/fake_news_image/6498.jpg,1
7850,“适老版”药品说明书正陆续进入市场,images/real_news_image/14076.jpg,0
7851,液体缓释氮肥不是免登记产品！用户请注意肥料登记证！          ,images/fake_news_image/4315.jpg,1
7852,牛炭疽疫情，会影响我们吃肉,images/fake_news_image/5057.jpg,1
7853,‘玉兔二号’重大故障”“探月工程‘劳民伤财’,images/fake_news_image/7048.jpg,1
7854,城镇职工和城乡居民基本养老保险能互转,images/fake_news_image/8732.jpg,1
7855,美国“暖心法官”庭审视频都是演的,images/fake_news_image/5620.jpg,1
7856,"个人账户“钱”少了会影响医保待遇,统筹基金没钱了",images/fake_news_image/8889.jpg,1
7857,创新高！1至7月全国铁路发送旅客超25亿人次,images/real_news_image/7787.jpg,0
7858,水果越酸，维生素C含量越高,images/fake_news_image/3141.jpg,1
7859,2023年7月以来民航公安机关打击处理“机闹”669起,images/real_news_image/15590.jpg,0
7860,2024暑期档电影票房破50亿,images/real_news_image/9570.jpg,0
7861,“三伏热浪走 初秋气象新” 我国最早秋粮开始收获,images/real_news_image/6896.jpg,0
7862,全球第一台“华龙一号”核电机组投入商业运行,images/real_news_image/13697.jpg,0
7863,南品仁追忆祖父南怀瑾：早年出身黄埔 心系家国两岸,images/real_news_image/5566.jpg,0
7864,世预赛关键战：国足客场0:1不敌韩国队,images/real_news_image/12204.jpg,0
7865,"满月发汗能排毒,到底是真还是坑",images/fake_news_image/4961.jpg,1
7866,长沙7对建筑工地夫妻拍婚纱照迎七夕,images/real_news_image/15047.jpg,0
7867,中国虎野生种群数量恢复性增长,images/real_news_image/8661.jpg,0
7868,“90后”在酒泉：“摔跤吧！妈妈”,images/real_news_image/5364.jpg,0
7869,俄军在亚速钢铁厂内发现中文封面《孙子兵法》,images/fake_news_image/6192.jpg,1
7870,"地暖会加速散发甲醛,会致癌、诱发白血病",images/fake_news_image/10195.jpg,1
7871,《海贼王》要拍真人电影版,images/fake_news_image/7897.jpg,1
7872,山东泗水两辆重型半挂牵引车发生碰撞 致7死10伤,images/real_news_image/3758.jpg,0
7873,牛市早报｜国家药监局已批准44个新冠病毒抗原检测试剂产品,images/real_news_image/5234.jpg,0
7874,大型中法美食文化交流节目《巅峰食刻——中法厨王竞技》推出,images/real_news_image/15504.jpg,0
7875,葡萄干含促干剂，真不能吃了,images/fake_news_image/5077.jpg,1
7876,商务部：中国政府一如既往地欢迎世界各国企业来华投资兴业,images/real_news_image/13698.jpg,0
7877,阵风9级！北京遭大风沙尘天气 城区已现风沙,images/real_news_image/12810.jpg,0
7878,塔罗牌占卜可以预知未来,images/fake_news_image/9647.jpg,1
7879,推动高质量发展·权威发布｜工信部：大力推进新型工业化 强化科技创新和产业创新深度融合,images/real_news_image/10444.jpg,0
7880,母亲节将至香港名厨为长者祝寿,images/real_news_image/2910.jpg,0
7881,用水果代替主食可以减肥,images/fake_news_image/3805.jpg,1
7882,五部门：到2025年，优化调整高校20%左右学科专业布点,images/real_news_image/4183.jpg,0
7883,王毅：单边行径和保护主义必将被历史车轮碾碎,images/real_news_image/14401.jpg,0
7884,聊城市住建局 “告诫居民不要买房”,images/fake_news_image/7204.jpg,1
7885,八部门联合印发中医药文化弘扬工程实施方案,images/real_news_image/3771.jpg,0
7886,探访谷爱凌赛前密训基地：在此完成北京冬奥会前最后一练,images/real_news_image/10740.jpg,0
7887,市场探访：“雪糕刺客”少见 3元—5元价格带成主流,images/real_news_image/5776.jpg,0
7888,中新真探：晒眼皮真能治近视吗？,images/real_news_image/12835.jpg,0
7889,刚刚听说，西华地震了,images/fake_news_image/9233.jpg,1
7890,洋葱可以吸附新冠病毒,images/fake_news_image/8405.jpg,1
7891,中新网评：奋进的中国，发展成果惠及更多民众,images/real_news_image/14767.jpg,0
7892,教育部和各省（区、市）开通2023年高考举报电话,images/real_news_image/5437.jpg,0
7893,给手机无线充电会致癌,images/fake_news_image/4748.jpg,1
7894,抓实抓细“乙类乙管”各项措施——国务院联防联控机制新闻发布会回应防疫关切,images/real_news_image/4819.jpg,0
7895,在口罩中间垫上餐巾纸可以有效阻断新冠病毒,images/fake_news_image/8445.jpg,1
7896,以色列考古学家发现2700年前私人厕所,images/real_news_image/3342.jpg,0
7897,钟南山：已经挺过一个14天，7号开始第二个14天,images/fake_news_image/6801.jpg,1
7898,发改委回应闯红绿灯、错误垃圾分类被纳入失信行为,images/fake_news_image/9957.jpg,1
7899,国家防总针对重庆启动防汛四级应急响应,images/real_news_image/10222.jpg,0
7900,人这一辈子，一定要去看看三明的“无价之宝”,images/real_news_image/7690.jpg,0
7901,伊朗前总统内贾德：将参加总统竞选,images/real_news_image/12875.jpg,0
7902,血液黏稠不等于高血脂,images/fake_news_image/10243.jpg,1
7903,金星有大规模火山活动吗？最新研究发现正处于火山活跃期证据,images/real_news_image/13319.jpg,0
7904,蔡英文称大陆通过军演升高对台“威胁”？国台办回应,images/real_news_image/2776.jpg,0
7905,“宝总”终于来了！下一个会是谁？,images/real_news_image/12152.jpg,0
7906,泰国今年外国游客量突破1300万人次,images/real_news_image/14475.jpg,0
7907,天津市体育局：前CBA球员孟祥宇实名反映的问题不属实,images/real_news_image/4522.jpg,0
7908,贫铀、反战与国际行动中心,images/real_news_image/4959.jpg,0
7909,郑州住房“以旧换新”有啥要求 看看你的房龄够不够？,images/real_news_image/14849.jpg,0
7910,胡萝卜吃多了容易不孕,images/fake_news_image/5136.jpg,1
7911,澳门特区行政长官选举日确定,images/real_news_image/7786.jpg,0
7912,雷海潮已任国家卫健委党组书记,images/real_news_image/15175.jpg,0
7913,我国首批适老化药品说明书已上市 你注意到了吗？,images/real_news_image/14917.jpg,0
7914,“第1号通告”武汉暂停客运,images/fake_news_image/9107.jpg,1
7915,交通部回应“禁止折叠电动车等上地铁”：全国未统一禁止携带物品目录,images/real_news_image/14639.jpg,0
7916,蹲下起来就头晕是贫血,images/fake_news_image/7565.jpg,1
7917,中新人物｜陈丽君：戏曲演员 哪有学成这一说？,images/real_news_image/12695.jpg,0
7918,湖南“00后”困难学子大学期间“逆袭”创业大咖,images/real_news_image/15587.jpg,0
7919,实地探访三星堆遗址发掘现场 每一块土都有它的“身份证”,images/real_news_image/13194.jpg,0
7920,中国成功发射试验二十一号卫星,images/real_news_image/5433.jpg,0
7921,乌克兰民众扔汽油弹摧毁俄装甲车,images/fake_news_image/6279.jpg,1
7922,官方：新冠病毒感染病例死亡后24小时内填报死因诊断,images/real_news_image/5214.jpg,0
7923,三峡水库提前消落到位转入防洪调度,images/real_news_image/12492.jpg,0
7924,！三江15岁女孩遭围殴暴打,images/fake_news_image/7248.jpg,1
7925,美国公布佩洛西“空军一号”专机185公里安全距离,images/fake_news_image/5346.jpg,1
7926,6000余只大天鹅飞抵“中国大天鹅之乡”山东荣成越冬,images/real_news_image/14168.jpg,0
7927,黑蒜真有那么神奇 菊花酒能延年益寿,images/fake_news_image/4742.jpg,1
7928,国产大飞机C919飞越香港维多利亚港,images/real_news_image/7213.jpg,0
7929,国家统计局：抓紧构建房地产发展新模式，促进房地产高质量发展,images/real_news_image/14257.jpg,0
7930,老版优步App停用，用户免密支付账号有风险,images/fake_news_image/3428.jpg,1
7931,新冠疫情迫使中国家庭当街焚化尸体,images/fake_news_image/6041.jpg,1
7932,12月31日前可以申领高龄津贴,images/fake_news_image/9123.jpg,1
7933,中国驻东盟大使侯艳琪：中国东盟合作应如何提质升级？,images/real_news_image/3103.jpg,0
7934,父亲带12岁儿子徒步进藏遭质疑 ,images/fake_news_image/3126.jpg,1
7935,无锡一学生接种疫苗后死亡,images/fake_news_image/8165.jpg,1
7936,失眠者睡前吃香蕉易入睡,images/fake_news_image/4512.jpg,1
7937,暴雨红色预警，浙江、江西情况怎样？,images/real_news_image/11139.jpg,0
7938,北京公交警方：男子在地铁扶梯上偷拍女生裙底被行拘,images/real_news_image/9249.jpg,0
7939,网民冒充某大学原教授发虚假《致歉函》 被采取刑事强制措施,images/real_news_image/8436.jpg,0
7940,青海民大回应党委副书记报考本校研究生事件：取消拟录取资格,images/real_news_image/6317.jpg,0
7941,长三角铁路客流持续保持高位运行 5月2日预计发送旅客超360万人次,images/real_news_image/15415.jpg,0
7942,“日行万步”真的有益于健康,images/fake_news_image/4188.jpg,1
7943,石家庄爱心人士为外卖、快递小哥等提供免费餐食,images/real_news_image/13820.jpg,0
7944,德国火葬场为节能实行5人混烧,images/fake_news_image/5333.jpg,1
7945,“70后”金融大员李云泽履新，曾是“老建行人”,images/real_news_image/5852.jpg,0
7946,秋意正浓 绵延秦岭“披”上色彩斑斓的“秋装”,images/real_news_image/7561.jpg,0
7947,超励志画面：成群鲷鱼努力跳过2米高瀑布,images/real_news_image/5766.jpg,0
7948,特朗普对话马斯克，回忆自己遇刺时刻，还谈了什么？,images/real_news_image/7720.jpg,0
7949,中新真探：有结石的患者就不能吃豆制品？,images/real_news_image/16311.jpg,0
7950,拜登称需尽快达成停火协议 以色列试图修改谈判条款,images/real_news_image/8815.jpg,0
7951,尼日利亚发生多起自杀式袭击 已造成至少18人遇难,images/real_news_image/10800.jpg,0
7952,针对江西等省强降雨过程 国家防总启动防汛四级应急响应,images/real_news_image/3127.jpg,0
7953,柿子和螃蟹、牛奶一起吃会中毒,images/fake_news_image/5080.jpg,1
7954,苏州星海广场地铁站发生砍人事件,images/fake_news_image/6643.jpg,1
7955,俄罗斯罗斯托夫州一地宣布进入紧急状态,images/real_news_image/7313.jpg,0
7956,（八闽千姿）一座均庆寺 两岸佛缘牵,images/real_news_image/12326.jpg,0
7957,为何越来越多大学生毕业后“反向”读职校？,images/real_news_image/8686.jpg,0
7958,民族的也是世界的 新疆传统民族乐器何以走得更远？,images/real_news_image/4612.jpg,0
7959,我国主产区冬小麦收获进度达4.8% 多地“虫口夺粮”夯实丰收之基,images/real_news_image/5646.jpg,0
7960,嫦娥六号任务计划5月3日发射,images/real_news_image/15437.jpg,0
7961,国家统计局：今年以来工业生产增长较快 转型升级持续推进,images/real_news_image/11728.jpg,0
7962,黄河河道内河汊纵横如大地血脉 阳光下美丽壮观,images/real_news_image/9189.jpg,0
7963,心脏支架已被美国淘汰,images/fake_news_image/10049.jpg,1
7964,因爱吮吸自己脚指头 袋鼠宝宝被穿上袜子,images/real_news_image/13924.jpg,0
7965,多地高薪招聘聘任制公务员 什么样的人可以应聘？,images/real_news_image/13284.jpg,0
7966,水利部部署近期华南西南强降雨防范工作,images/real_news_image/14315.jpg,0
7967,深圳2021年将征房地产税,images/fake_news_image/10051.jpg,1
7968,地质灾害风险预警：浙江江西福建等局地发生地质灾害的气象风险高,images/real_news_image/11836.jpg,0
7969,"行人赖在斑马线上不走咋办,12月起新交规实施",images/fake_news_image/2924.jpg,1
7970,｜海口吾悦广场有人跳楼,images/fake_news_image/7056.jpg,1
7971,黄金白银又疯狂！金饰价格飙升 每克突破742元,images/real_news_image/13983.jpg,0
7972,陕西发现罕见唐墓壁画,images/real_news_image/13906.jpg,0
7973,意大利政府将新冠病人尸体丢入万人坑,images/fake_news_image/8309.jpg,1
7974,人这一辈子，一定要去一趟黄帝故里拜祖！,images/real_news_image/3710.jpg,0
7975,【奥运画刊第十八期】谁是最强零零后？,images/real_news_image/11925.jpg,0
7976,“地壳一号”万米钻机相关技术成果获广泛应用,images/real_news_image/8469.jpg,0
7977,红外线体温计不会导致眼部灼伤、视力下降、易发白内障          ,images/fake_news_image/4430.jpg,1
7978,南宁市朝阳广场有人抢小孩,images/fake_news_image/6570.jpg,1
7979,海河水利委员会专题部署第3号台风“格美”强降雨防范工作,images/real_news_image/9173.jpg,0
7980,佩洛西访台前，俄罗斯地标建筑打出标语撑中国,images/fake_news_image/5342.jpg,1
7981,今年第14次沙尘天气过程影响中国,images/real_news_image/2666.jpg,0
7982,小便颜色发黄，就是上火的标志,images/fake_news_image/3945.jpg,1
7983,针对安徽暴雨洪涝灾害 国家救灾应急响应提升至三级,images/real_news_image/10695.jpg,0
7984,牛奶真的不能空腹食用,images/fake_news_image/5277.jpg,1
7985,土耳其内姆鲁特山星空璀璨 仿佛神秘异世界,images/real_news_image/11610.jpg,0
7986,“二折就是赔钱！”多家出版社为何一起说“不”,images/real_news_image/13774.jpg,0
7987,宁夏煤业双马一矿发布与孙国友协商进展情况,images/real_news_image/6469.jpg,0
7988,（经济观察）中国经济频获国际“信任票”,images/real_news_image/12834.jpg,0
7989,中新健康丨全国各地医保部门集中开展定点零售药店合规经营谈话提醒,images/real_news_image/9038.jpg,0
7990,网购商品缺斤少两时有发生，消费者应该如何维权？,images/real_news_image/6808.jpg,0
7991,国家发改委：欧盟限制中国电动汽车将加剧其化石能源依赖,images/real_news_image/11852.jpg,0
7992,央行定于5月20日发行2023吉祥文化金银纪念币一套,images/real_news_image/2855.jpg,0
7993,第十七届“良辰美景·恭王府非遗演出季”昆曲专场,images/real_news_image/12348.jpg,0
7994,突传噩耗！又一位“金牌绿叶”走了……,images/real_news_image/14090.jpg,0
7995,中国从泰国引渡首名经济犯罪嫌疑人 涉案资金超千亿,images/real_news_image/6956.jpg,0
7996,国家防总维持针对京津冀等多地防汛四级应急响应,images/real_news_image/7899.jpg,0
7997,食药监总局公众号“整治进行时”上线,images/fake_news_image/2826.jpg,1
7998,中新电竞对话北京WB暖阳：依旧在寻找,images/real_news_image/14615.jpg,0
7999,有多少化肥被人或者动物直接食用了,images/fake_news_image/4318.jpg,1
8000,吴瑞坤荣获2023年“上海好护士”提名奖，长期坚守一线,images/real_news_image/4957.jpg,0
8001,冠心病的痛就是胸痛或者心前区痛,images/fake_news_image/8798.jpg,1
8002,今年首季度经横琴口岸出入境旅客超340万人次,images/real_news_image/4106.jpg,0
8003,复旦大学副教授朱杰进上了美国制裁名单,images/fake_news_image/5972.jpg,1
8004,市场监管总局：截至5月底，我国实有民营经济主体总量18045万户,images/real_news_image/11991.jpg,0
8005,（经济观察）中国主要经济指标回升 政策效能料持续释放,images/real_news_image/11694.jpg,0
8006,荧光增白剂是致病之源,images/fake_news_image/7915.jpg,1
8007,“京津冀及周边工地将停半年”,images/fake_news_image/7136.jpg,1
8008,2026年世界杯亚洲区预选赛十八强赛分组揭晓,images/real_news_image/10962.jpg,0
8009,中美防长在香格里拉对话会期间于新加坡举行会晤,images/real_news_image/13044.jpg,0
8010,全国青少年航模锦标赛开幕 千余名航模高手共角逐,images/real_news_image/7961.jpg,0
8011,南昌23中教师要求学生在南昌八一起义纪念馆购买高价纪念品,images/fake_news_image/8753.jpg,1
8012,闽南发生青年男子棍打跪地老人,images/fake_news_image/3122.jpg,1
8013,美国示威者手举五星红旗，呼吁中国帮忙?,images/fake_news_image/5962.jpg,1
8014,日媒：日本小笠原群岛发生6.0级地震 没有海啸风险,images/real_news_image/13970.jpg,0
8015,2024年“中国500最具价值品牌”：国家电网、工行和海尔蝉联前三,images/real_news_image/11512.jpg,0
8016,中国团队研发系列仿人灵巧手机器人获日内瓦国际发明展金奖,images/real_news_image/15650.jpg,0
8017,耐克推出限量版含人血“撒旦鞋”,images/fake_news_image/5783.jpg,1
8018,奥密克戎变异株“双头犬”名称由来是因为长的像犬,images/fake_news_image/3749.jpg,1
8019,太阳活动 对地球影响特别大,images/fake_news_image/9525.jpg,1
8020,多地开始40℃高温模式，要做哪些准备？,images/real_news_image/12019.jpg,0
8021,防范新冠病毒传播 墨尔本街头芭蕾舞者塑料泡中起舞,images/real_news_image/14131.jpg,0
8022,中国三大石窟首次联展 3D打印窟龛亮相,images/real_news_image/14526.jpg,0
8023,天津河北区发生老太太拐骗儿童事件,images/fake_news_image/9280.jpg,1
8024,跨境电商“日子没以前滋润了”，逆风下如何保持盈利,images/real_news_image/6578.jpg,0
8025,中东第二个巴铁豪赠中国800亿油田,images/fake_news_image/5623.jpg,1
8026,黄河壶口瀑布现金瀑飞流景观,images/real_news_image/7995.jpg,0
8027,美国FDA发文禁止进口日本食品,images/fake_news_image/5767.jpg,1
8028,补脑营养液能“补脑”,images/fake_news_image/9610.jpg,1
8029,云南丽江塔城乡森林火灾已全部扑灭 火场转入清理看守阶段,images/real_news_image/3832.jpg,0
8030,“高辐射宇宙射线来袭”是真的,images/fake_news_image/5293.jpg,1
8031,“公务员课程”进大学，是教大学生考公吗？,images/real_news_image/4577.jpg,0
8032,中国人将接受全球首例换头手术,images/fake_news_image/7927.jpg,1
8033,意大利总理梅洛尼将访华 中方介绍此访有关安排,images/real_news_image/8987.jpg,0
8034,防沙治沙 中国新设“三北”工程补助资金,images/real_news_image/12822.jpg,0
8035,蔡英文将窜访危地马拉？中方：希望危地马拉认清大势，早日作出正确选择,images/real_news_image/6494.jpg,0
8036,海南“新农人”返乡躬耕水稻试验田 用智慧科技为农业赋能,images/real_news_image/15673.jpg,0
8037,美国众议院议长佩洛西打疫苗是装的,images/fake_news_image/5862.jpg,1
8038,四川省绵阳市北川羌族自治县擂鼓宣布：昨天凌晨二点二十一分，一女性感染SB250病毒死亡，年龄25岁，参与抢救的医生已经被隔离……因安县有121个鱼塘已感染,images/fake_news_image/6648.jpg,1
8039,吃西瓜要吐籽，否则肚子里会长出西瓜？,images/fake_news_image/8662.jpg,1
8040,探访中国首座公共科考码头：打造深海科考“服务站”,images/real_news_image/7658.jpg,0
8041,云南保山5.2级地震受伤人数升至9人 8人已出院,images/real_news_image/3243.jpg,0
8042,北京升级发布高温橙色预警信号,images/real_news_image/12306.jpg,0
8043,受疫情影响，有人在上海芮欧百货停车场过夜,images/fake_news_image/8111.jpg,1
8044,俄罗斯今夏异常寒冷，都是中国卫星惹的祸,images/fake_news_image/7437.jpg,1
8045,报告：“以旧换新”行动推动二季度掀起家电回收热潮,images/real_news_image/9209.jpg,0
8046,水利部会商部署新一轮强降雨防御工作,images/real_news_image/12312.jpg,0
8047,国家能源局：我国新型能源体系建设取得积极进展,images/real_news_image/11448.jpg,0
8048,印度吃死上百儿童，怀疑荔枝吃出脑炎,images/fake_news_image/4666.jpg,1
8049,陕西汉阴探索“林下经济”：因地制宜助闲置资源变“致富地”,images/real_news_image/12238.jpg,0
8050,儿童乘机“无陪伴服务”如何申请？注意点啥？详戳,images/real_news_image/10522.jpg,0
8051,欧洲杯丨西班牙意大利双双取胜 16岁亚马尔创纪录,images/real_news_image/11822.jpg,0
8052,河北省社保局要求退休职工必须在1月底完成生存认证,images/fake_news_image/9788.jpg,1
8053,"""上了天""的种子有放射性 太空蔬菜那么可怕          ",images/fake_news_image/4818.jpg,1
8054,传成都某旅游区散养小熊猫供人接触 ,images/fake_news_image/3120.jpg,1
8055,街边烤肠=食品添加剂+仿生肉,images/fake_news_image/3064.jpg,1
8056,视频：蒙古国捐赠中国的三万只羊正在二连浩特入境,images/fake_news_image/8393.jpg,1
8057,生态环境部：入河、入海排污口监督管理办法将印发,images/real_news_image/8645.jpg,0
8058,大陆投10亿“介入”岛内选举,images/fake_news_image/7096.jpg,1
8059,澳门：4月28日起调整佩戴口罩指引,images/real_news_image/4967.jpg,0
8060,成都某小区一阿姨误喝核酸试管水,images/fake_news_image/7982.jpg,1
8061,巴西世界最大湿地遭遇创纪录大火 濒危物种生存堪忧,images/real_news_image/14869.jpg,0
8062,华北等地将有较强降雨 南方大部地区高温天气持续,images/real_news_image/8064.jpg,0
8063,美国加拿大叫停仰卧起坐,images/fake_news_image/7706.jpg,1
8064,前7月，我国进出口规模创历史同期新高,images/real_news_image/7376.jpg,0
8065,逐梦教育强国路 奋进数字教育新征程,images/real_news_image/11142.jpg,0
8066,国务院任免国家工作人员,images/real_news_image/2678.jpg,0
8067,台风“派比安”将致粤西强降雨,images/real_news_image/9416.jpg,0
8068,台湾营建业景气动向结束连续三个月上扬,images/real_news_image/6760.jpg,0
8069,房产中介员工朋友圈传海南限购被行拘,images/fake_news_image/2720.jpg,1
8070,为何食品安全博士劝别人少吃小龙虾,images/fake_news_image/4625.jpg,1
8071,“人民楷模”国家荣誉称号获得者王启民同志逝世 享年87岁,images/real_news_image/6979.jpg,0
8072,中国司机在新西兰总是撞死人、撞死马,images/fake_news_image/7427.jpg,1
8073,青岛沃尔玛总仓检测出新冠阳性,images/fake_news_image/6490.jpg,1
8074,突发！韩国医协宣布自6月18日起集体停诊,images/real_news_image/12353.jpg,0
8075,国际识局：事关欧洲的前途，这场重要选举来了,images/real_news_image/12568.jpg,0
8076,（改革进行时）从更加公平正义看法治中国的底色,images/real_news_image/9833.jpg,0
8077,“石家庄要解封，单双号限行 ,images/fake_news_image/9752.jpg,1
8078,斯诺克冠军联赛：吴宜泽成首位晋级32强的中国选手,images/real_news_image/11547.jpg,0
8079,用火烧不着的口罩是真口罩,images/fake_news_image/8480.jpg,1
8080,中国反兴奋剂中心发布关于涉及中国游泳运动员美雄酮代谢物阳性案件的声明,images/real_news_image/8459.jpg,0
8081,中新真探：头发太长会和身体抢营养吗？,images/real_news_image/9703.jpg,0
8082,法国推职业高中教育改革 年度投入拟增10亿欧元,images/real_news_image/3193.jpg,0
8083,“十四五”期间闲置总量将达60亿部 废旧手机都去哪了？,images/real_news_image/8066.jpg,0
8084,社保卡损坏换新卡，会影响账户内资金,images/fake_news_image/8776.jpg,1
8085,拍了拍年度最大“超级月亮” 这波中国风氛围已拉满,images/real_news_image/9928.jpg,0
8086,地暖有辐射还会引发疾病,images/fake_news_image/4829.jpg,1
8087,大熊猫国家公园唐家河片区拍到大熊猫“练功”,images/real_news_image/4513.jpg,0
8088,这次是“上海68名男女感染死亡”，SB250“升级”,images/fake_news_image/7895.jpg,1
8089,中俄元首携手谱写双边关系新篇章,images/real_news_image/14113.jpg,0
8090,波特兰抗议者高举红旗：美国民主社会主义者,images/fake_news_image/5904.jpg,1
8091,赖清德公布行政团队第六波任命名单,images/real_news_image/16149.jpg,0
8092,划清红线！《公平竞争审查条例》明确19项政策措施不得包含内容,images/real_news_image/11370.jpg,0
8093,一口唾沫能测出孩子天赋基因,images/fake_news_image/2860.jpg,1
8094,洗澡先洗头，会让脑血管受热膨胀导致脑溢血,images/fake_news_image/5118.jpg,1
8095,苏格兰高地秋景唯美 静谧如童话世界,images/real_news_image/11277.jpg,0
8096,1个西瓜等于6碗米饭,images/fake_news_image/4118.jpg,1
8097,中新健康丨国家中医药管理局：2026年底完成210项中医药标准制定,images/real_news_image/8518.jpg,0
8098,台南一农机行火灾致五人死亡,images/real_news_image/7724.jpg,0
8099,“三岁四岁不分房，五岁六岁悔断肠”是真的,images/fake_news_image/4364.jpg,1
8100,成都高新区一男子李某为新增新冠肺炎确诊病例,images/fake_news_image/10029.jpg,1
8101,广西百色：洪水淹没村庄 武警官兵紧急转移受困民众,images/real_news_image/12266.jpg,0
8102,沈阳发布进一步促进外来人口落户若干政策措施,images/real_news_image/14699.jpg,0
8103,今秋小学学制变5年、初中变4年,images/fake_news_image/9057.jpg,1
8104,湖北随州一家人因染病厌世从27楼往下撒钱,images/fake_news_image/8475.jpg,1
8105,叙利亚第一夫人确诊白血病后首发声：将与疾病抗争,images/real_news_image/13505.jpg,0
